{
  "$schema": "http://json-schema.org/draft-07/schema#",
  "title": "Credential Application",
  "type": "object",
  "properties": {
    "id": { "type": "string" },
    "spec_version": { "type" : "string" },
    "manifest_id": { "type": "string" },
    "applicant": { "type": "string" },
    "format": {
      "type": "object",
      "patternProperties": {
        "^jwt$|^jwt_vc$|^jwt_vp$": {
          "type": "object",
          "properties": {
            "alg": {
              "type": "array",
              "minItems": 1,
              "items": { "type": "string" }
            }
          },
          "required": ["alg"],
          "additionalProperties": false
        },
        "^ldp_vc$|^ldp_vp$|^ldp$": {
          "type": "object",
          "properties": {
            "proof_type": {
              "type": "array",
              "minItems": 1,
              "items": { "type": "string" }
            }
          },
          "required": ["proof_type"],
          "additionalProperties": false
        }
      },
      "additionalProperties": false
    },
    "presentation_submission": {
      "type": "object",
      "properties": {
        "id": { "type": "string" },
        "definition_id": { "type": "string" },
        "descriptor_map": {
          "type": "array",
          "items": { "$ref": "#/definitions/descriptor" }
        }
      },
      "required": ["id", "definition_id", "descriptor_map"],
      "additionalProperties": false
    }
  },
  "definitions": {
    "descriptor": {
      "type": "object",
      "properties": {
        "id": { "type": "string" },
        "path": { "type": "string" },
        "path_nested": {
          "type": "object",
          "$ref": "#/definitions/descriptor"
        },
        "format": {
          "type": "string",
          "enum": ["jwt", "jwt_vc", "jwt_vp", "ldp", "ldp_vc", "ldp_vp"]
        }
      },
      "required": ["id", "path", "format"],
      "additionalProperties": false
    }
  },
  "required": ["id", "spec_version", "manifest_id", "format"],
  "additionalProperties": false
}
