{
  "id": "9b1deb4d-3b7d-4bad-9bdd-2b0d7b3dcb6d",
  "spec_version": "https://identity.foundation/credential-manifest/spec/v1.0.0/",
  "applicant": "did:example:123",
  "manifest_id": "WA-DL-CLASS-A",
  "format": {
    "ldp_vc": {
      "proof_type": [
        "JsonWebSignature2020",
        "EcdsaSecp256k1Signature2019"
      ]
    }
  },
  "presentation_submission": {
    "id": "a30e3b91-fb77-4d22-95fa-871689c322e2",
    "definition_id": "32f54163-7166-48f1-93d8-ff217bdb0653",
    "descriptor_map": [
      {
        "id": "input_1",
        "format": "jwt_vc",
        "path": "$.verifiableCredential[0]"
      },
      {
        "id": "input_2",
        "format": "ldp_vc",
        "path": "$.verifiableCredential[1]"
      },
      {
        "id": "input_3",
        "format": "ldp_vc",
        "path": "$.verifiableCredential[2]"
      }
    ]
  }
}